Main Category,Sub Category,Name,Description,Price,Stock
Electronics,Phone Accessories,Belkin Screen Protectors Brother,"Treatment, Pro Quality, Bestseller",38.99,36
Electronics,Phone Accessories,Belkin Cases Service,"Vote, Deluxe Quality, Bestseller",47.62,92
Electronics,Phone Accessories,Belkin Cases Despite,"Sea, Pro Quality, New",16.21,74
Electronics,Phone Accessories,Samsung Chargers Your,"Total, Basic Quality, Bestseller",65.38,95
Electronics,Phone Accessories,JBL Chargers Option,"However, Deluxe Quality, New",39.76,78
Electronics,Phone Accessories,Anker Cases Plant,"Each, Premium Quality, Limited Edition",46.17,43
Electronics,Phone Accessories,Logitech Chargers Determine,"Security, Premium Quality, Bestseller",45.88,51
Electronics,Phone Accessories,JBL Cases Kind,"Indicate, Basic Quality, Bestseller",57.47,63
Electronics,Phone Accessories,Belkin Screen Protectors Continue,"Stuff, Premium Quality, New",48.56,51
Electronics,Laptop Accessories,Samsung Cooling Pads Fly,"Power, Premium Quality, Bestseller",20.38,73
Electronics,Laptop Accessories,JBL External Drives Sometimes,"Improve, Premium Quality, New",25.95,65
Electronics,Laptop Accessories,JBL External Drives Skill,"Industry, Pro Quality, New",88.72,86
Electronics,Laptop Accessories,Apple USB Hubs By,"Certain, Basic Quality, Limited Edition",184.54,38
Electronics,Laptop Accessories,Belkin External Drives Again,"List, Premium Quality, Bestseller",81.43,20
Electronics,Laptop Accessories,JBL Docking Stations Than,"Institution, Pro Quality, New",71.82,60
Electronics,Laptop Accessories,Apple Docking Stations Civil,"Color, Pro Quality, New",194.23,51
Electronics,Laptop Accessories,Logitech Docking Stations Teacher,"Of, Deluxe Quality, New",43.39,46
Electronics,Laptop Accessories,Samsung Docking Stations Stuff,"Able, Basic Quality, Limited Edition",140.35,97
Electronics,Gaming Accessories,Samsung Headsets Change,"Low, Basic Quality, Limited Edition",276.11,83
Electronics,Gaming Accessories,Samsung Controllers Must,"Mean, Pro Quality, Limited Edition",157.91,12
Electronics,Gaming Accessories,Anker Headsets Sense,"Record, Premium Quality, Limited Edition",238.85,29
Electronics,Gaming Accessories,Anker Mouse Pads Sure,"Green, Basic Quality, Limited Edition",223.56,77
Electronics,Gaming Accessories,Logitech Mouse Pads Will,"Soon, Premium Quality, Limited Edition",229.5,97
Electronics,Gaming Accessories,Apple Keyboards Less,"Quickly, Premium Quality, Bestseller",282.17,8
Electronics,Gaming Accessories,Logitech Gaming Mice Service,"Character, Premium Quality, Limited Edition",64.16,51
Electronics,Gaming Accessories,Belkin Gaming Mice Teacher,"Establish, Deluxe Quality, Bestseller",296.41,26
Electronics,Gaming Accessories,Samsung Mouse Pads Edge,"This, Premium Quality, New",169.71,45
Electronics,Camera Gear,Belkin Tripods Tough,"Memory, Deluxe Quality, New",479.4,80
Electronics,Camera Gear,Anker Memory Cards Catch,"Stuff, Basic Quality, Limited Edition",42.02,84
Electronics,Camera Gear,Logitech Bags Check,"Building, Basic Quality, Bestseller",339.87,38
Electronics,Camera Gear,Apple Memory Cards Team,"Man, Pro Quality, Bestseller",461.66,11
Electronics,Camera Gear,Belkin Bags Suddenly,"Believe, Deluxe Quality, Limited Edition",97.19,36
Electronics,Camera Gear,Logitech Lenses Run,"Face, Premium Quality, Bestseller",327.48,11
Electronics,Camera Gear,Logitech Tripods Someone,"Green, Deluxe Quality, Limited Edition",383.25,65
Electronics,Camera Gear,Sony Filters Material,"Herself, Premium Quality, New",441.98,26
Electronics,Camera Gear,Logitech Memory Cards School,"Maybe, Premium Quality, New",164.84,98
Electronics,Audio Equipment,Belkin Headphones Defense,"Pass, Basic Quality, Bestseller",48.03,44
Electronics,Audio Equipment,Apple Earbuds Suggest,"Again, Pro Quality, Bestseller",326.23,25
Electronics,Audio Equipment,Samsung Speakers Do,"Well, Premium Quality, Limited Edition",301.48,17
Electronics,Audio Equipment,Anker Headphones Gas,"Hair, Deluxe Quality, Bestseller",207.68,98
Electronics,Audio Equipment,Anker Sound Cards Station,"Economic, Pro Quality, Bestseller",46.86,19
Electronics,Audio Equipment,Anker Earbuds Life,"Age, Premium Quality, Limited Edition",220.52,59
Electronics,Audio Equipment,Apple Headphones News,"Smile, Deluxe Quality, New",159.85,25
Electronics,Audio Equipment,Logitech Sound Cards Baby,"Anything, Pro Quality, New",90.18,8
Electronics,Audio Equipment,Samsung Sound Cards Environment,"Prevent, Premium Quality, New",239.55,24
Clothing,Men's Fashion,Adidas Jeans First,"Pattern, Basic Quality, Limited Edition",101.34,5
Clothing,Men's Fashion,Adidas Jeans Southern,"Sing, Basic Quality, Bestseller",82.84,30
Clothing,Men's Fashion,H&M Jackets On,"All, Pro Quality, New",35.62,99
Clothing,Men's Fashion,H&M T-Shirts Want,"Decide, Premium Quality, Limited Edition",112.82,40
Clothing,Men's Fashion,Uniqlo Jackets Election,"Film, Premium Quality, Bestseller",73.55,27
Clothing,Men's Fashion,Under Armour Shirts Hand,"Strong, Premium Quality, New",119.03,12
Clothing,Men's Fashion,Zara T-Shirts Strong,"Wrong, Basic Quality, Limited Edition",101.57,27
Clothing,Men's Fashion,Uniqlo T-Shirts Run,"Talk, Basic Quality, Limited Edition",59.75,13
Clothing,Men's Fashion,Levi's T-Shirts Politics,"Face, Deluxe Quality, Limited Edition",97.99,85
Clothing,Women's Fashion,Zara Blouses Report,"Or, Deluxe Quality, Bestseller",159.19,82
Clothing,Women's Fashion,H&M Blouses Respond,"Research, Premium Quality, Bestseller",153.34,72
Clothing,Women's Fashion,H&M Skirts Authority,"Year, Basic Quality, Bestseller",114.71,42
Clothing,Women's Fashion,Levi's Dresses Bank,"Hit, Pro Quality, New",112.81,79
Clothing,Women's Fashion,Adidas Skirts Development,"Perform, Pro Quality, Bestseller",26.83,58
Clothing,Women's Fashion,Uniqlo Skirts Include,"Person, Deluxe Quality, Limited Edition",73.15,25
Clothing,Women's Fashion,H&M Tops Vote,"Safe, Deluxe Quality, Bestseller",126.6,31
Clothing,Women's Fashion,H&M Tops Situation,"Question, Basic Quality, Bestseller",175.67,76
Clothing,Women's Fashion,Uniqlo Pants Animal,"Deep, Pro Quality, Bestseller",25.31,89
Clothing,Kids' Fashion,H&M Sets Relate,"Last, Pro Quality, Bestseller",26.64,93
Clothing,Kids' Fashion,Uniqlo T-Shirts We,"Blood, Deluxe Quality, New",20.14,5
Clothing,Kids' Fashion,Under Armour Shoes Them,"Marriage, Premium Quality, Limited Edition",19.86,91
Clothing,Kids' Fashion,Nike T-Shirts Crime,"Administration, Deluxe Quality, Bestseller",33.28,41
Clothing,Kids' Fashion,Under Armour T-Shirts Traditional,"Like, Basic Quality, New",15.23,83
Clothing,Kids' Fashion,Under Armour Pants Late,"The, Premium Quality, New",27.89,35
Clothing,Kids' Fashion,Adidas Pants Agreement,"Small, Premium Quality, Bestseller",70.25,30
Clothing,Kids' Fashion,Nike Pants Mention,"Car, Pro Quality, Limited Edition",31.47,93
Clothing,Kids' Fashion,Under Armour Shoes Grow,"Citizen, Deluxe Quality, New",36.53,75
Clothing,Athletic Wear,Nike Jerseys Whatever,"Sit, Basic Quality, Limited Edition",27.31,33
Clothing,Athletic Wear,Zara Shorts Dinner,"Modern, Basic Quality, New",26.4,77
Clothing,Athletic Wear,Uniqlo Shorts Forget,"Collection, Deluxe Quality, Limited Edition",77.3,5
Clothing,Athletic Wear,Zara Sports Bras A,"Manager, Premium Quality, Bestseller",76.63,18
Clothing,Athletic Wear,Levi's Jerseys Administration,"Music, Premium Quality, New",79.06,42
Clothing,Athletic Wear,Adidas Tank Tops Society,"Recently, Deluxe Quality, New",83.65,66
Clothing,Athletic Wear,Uniqlo Sports Bras Method,"History, Pro Quality, New",43.23,87
Clothing,Athletic Wear,Uniqlo Leggings Public,"Soon, Premium Quality, New",22.61,76
Clothing,Athletic Wear,H&M Tank Tops Many,"View, Basic Quality, New",76.64,85
Clothing,Fashion Accessories,Nike Bags Throughout,"Idea, Basic Quality, Bestseller",97.91,26
Clothing,Fashion Accessories,Levi's Bags Thus,"Few, Pro Quality, Bestseller",39.47,27
Clothing,Fashion Accessories,Uniqlo Belts Identify,"Call, Deluxe Quality, Bestseller",40.28,6
Clothing,Fashion Accessories,Nike Hats Foreign,"Everyone, Premium Quality, Bestseller",113.49,47
Clothing,Fashion Accessories,Zara Scarves Stand,"Produce, Deluxe Quality, Bestseller",54.62,89
Clothing,Fashion Accessories,Under Armour Hats Social,"Southern, Basic Quality, Bestseller",90.63,60
Clothing,Fashion Accessories,Levi's Scarves Day,"Company, Deluxe Quality, New",43.56,48
Clothing,Fashion Accessories,Levi's Bags Herself,"Enjoy, Pro Quality, New",47.63,24
Clothing,Fashion Accessories,Nike Bags Message,"Woman, Deluxe Quality, Limited Edition",126.86,23
Home & Living,Living Room,SimpleHome TV Stands Each,"Kitchen, Premium Quality, Limited Edition",548.21,90
Home & Living,Living Room,SimpleHome Sofas Step,"Ground, Pro Quality, New",606.58,79
Home & Living,Living Room,SimpleHome Lamps Company,"Store, Premium Quality, New",732.41,22
Home & Living,Living Room,SimpleHome Coffee Tables Kind,"Who, Deluxe Quality, New",325.98,67
Home & Living,Living Room,IKEA Sofas Kid,"Try, Deluxe Quality, Bestseller",114.48,57
Home & Living,Living Room,ArtDeco Coffee Tables Series,"Dark, Deluxe Quality, Limited Edition",319.25,99
Home & Living,Living Room,ArtDeco Coffee Tables Impact,"Middle, Premium Quality, Bestseller",167.49,95
Home & Living,Living Room,LivingSpace TV Stands Would,"Five, Deluxe Quality, Bestseller",662.97,64
Home & Living,Living Room,IKEA Rugs Board,"Him, Premium Quality, Bestseller",918.77,41
Home & Living,Kitchen & Dining,SimpleHome Utensils Technology,"Top, Deluxe Quality, Bestseller",94.89,28
Home & Living,Kitchen & Dining,OXO Cookware Letter,"Environmental, Deluxe Quality, Bestseller",319.67,18
Home & Living,Kitchen & Dining,ArtDeco Cookware Board,"And, Pro Quality, New",39.56,82
Home & Living,Kitchen & Dining,LivingSpace Dinnerware Trip,"Commercial, Basic Quality, Limited Edition",181.37,22
Home & Living,Kitchen & Dining,OXO Cookware Buy,"Lot, Basic Quality, Bestseller",255.43,72
Home & Living,Kitchen & Dining,LivingSpace Appliances Record,"Piece, Basic Quality, Bestseller",131.13,59
Home & Living,Kitchen & Dining,LivingSpace Storage Until,"Cut, Basic Quality, Limited Edition",272.89,39
Home & Living,Kitchen & Dining,SimpleHome Appliances Particularly,"Difference, Basic Quality, Bestseller",214.91,92
Home & Living,Kitchen & Dining,LivingSpace Storage Lay,"In, Deluxe Quality, Bestseller",318.04,5
Home & Living,Bedroom,LivingSpace Bedding Sign,"Big, Deluxe Quality, Bestseller",91.76,93
Home & Living,Bedroom,IKEA Pillows Notice,"Too, Pro Quality, New",79.33,32
Home & Living,Bedroom,HomeStyle Lamps Organization,"Attention, Deluxe Quality, Limited Edition",56.24,11
Home & Living,Bedroom,HomeStyle Curtains Also,"Let, Pro Quality, New",45.67,18
Home & Living,Bedroom,ArtDeco Pillows Term,"Popular, Deluxe Quality, Bestseller",260.05,64
Home & Living,Bedroom,ArtDeco Storage Goal,"Soon, Pro Quality, New",298.79,90
Home & Living,Bedroom,ArtDeco Lamps Represent,"Direction, Pro Quality, New",221.14,13
Home & Living,Bedroom,SimpleHome Lamps Language,"Man, Pro Quality, Limited Edition",34.21,97
Home & Living,Bedroom,LivingSpace Storage Stay,"Stop, Basic Quality, Bestseller",134.42,34
Home & Living,Bathroom,IKEA Towels State,"Rule, Basic Quality, New",58.82,58
Home & Living,Bathroom,HomeStyle Towels Environment,"Space, Basic Quality, Bestseller",75.67,80
Home & Living,Bathroom,SimpleHome Towels It,"Kind, Basic Quality, Bestseller",131.91,68
Home & Living,Bathroom,HomeStyle Accessories Address,"Shoulder, Deluxe Quality, Bestseller",64.25,19
Home & Living,Bathroom,SimpleHome Shower Curtains World,"Allow, Premium Quality, New",95.65,61
Home & Living,Bathroom,LivingSpace Shower Curtains Manager,"Note, Basic Quality, Limited Edition",16.02,37
Home & Living,Bathroom,OXO Storage Husband,"Picture, Basic Quality, New",25.69,46
Home & Living,Bathroom,LivingSpace Accessories Discussion,"History, Pro Quality, Limited Edition",21.3,23
Home & Living,Bathroom,LivingSpace Storage Task,"Short, Premium Quality, New",141.52,75
Home & Living,Home Decor,OXO Wall Art Stop,"Support, Basic Quality, Bestseller",114.38,56
Home & Living,Home Decor,SimpleHome Vases State,"For, Premium Quality, Bestseller",53.32,48
Home & Living,Home Decor,LivingSpace Wall Art Like,"Check, Pro Quality, Limited Edition",100.63,77
Home & Living,Home Decor,LivingSpace Cushions Real,"Area, Premium Quality, New",181.03,29
Home & Living,Home Decor,ArtDeco Vases Bit,"Happen, Pro Quality, Bestseller",163.6,77
Home & Living,Home Decor,LivingSpace Vases Cold,"Exactly, Pro Quality, Limited Edition",37.3,27
Home & Living,Home Decor,OXO Vases Serious,"Their, Premium Quality, Limited Edition",193.74,30
Home & Living,Home Decor,LivingSpace Vases Interesting,"Black, Pro Quality, Bestseller",45.81,32
Home & Living,Home Decor,IKEA Candles Second,"Dark, Pro Quality, New",181.12,59
